<?xml version="1.0" encoding="utf-8"?>

<!DOCTYPE effect_pedal_catalogue SYSTEM "effect_pedal_catalogue.dtd">

<effect_pedal_catalogue>
    <effect_pedal analog_or_digital="Analog">
        <image>mythos.jpg</image>
        <name>
            <manufacturer_name>Mythos</manufacturer_name>
            <model_name>Golden Fleece</model_name>
        </name>
        <type>Overdrive Fuzz</type>
        <year_of_manufacturing>2019</year_of_manufacturing>
        <price currency="лв.">326.97</price>
        <power>
            <polarity>- в средата</polarity>
            <voltage>9 DC</voltage>
            <current_draw>10mA</current_draw>
            <battery has="Не"/>
        </power>
        <dimensions>
            <width unit="см">4</width>
            <height unit="см">4,5</height>
            <length unit="см">9,2</length>
        </dimensions>
        <weight unit="гр">128</weight>
        <true_bypass has="Да"/>
        <description>
            <text>
                Педал, който реагира прекрасно на вашата динамика на свирене, което води до топъл, мъркащ овърдрайв. Звучи твърде добре, за да е истина, нали? Но Golden Fleece от Mythos наистина преодолява границата между fuzz и овърдрайв педала. Педалът има един контрол за основна сила на звука, така че целият контрол на тона и усилването идва от вас и вашата китара. Намалете силата на звука и тонът се изчиства веднага.
            </text>
        </description>
    </effect_pedal>
</effect_pedal_catalogue>