<?xml version="1.0" encoding="utf-8"?>

<!DOCTYPE effect_pedal_catalogue SYSTEM "effect_pedal_catalogue.dtd">

<effect_pedal_catalogue>
    <effect_pedal analog_or_digital="Analog">
        <image>vemuram.jpg</image>
        <name>
            <manufacturer_name>Vemuram</manufacturer_name>
            <model_name>Jan Ray</model_name>
        </name>
        <type>Overdrive</type>
        <year_of_manufacturing>2017</year_of_manufacturing>
        <price currency="лв.">844.49</price>
        <power>
            <polarity>- в средата</polarity>
            <voltage>9 DC</voltage>
            <current_draw>5mA</current_draw>
            <battery has="Да"/>
        </power>
        <dimensions>
            <width unit="см">7</width>
            <height unit="см">5</height>
            <length unit="см">11,2</length>
        </dimensions>
        <weight unit="гр">428</weight>
        <true_bypass has="Да"/>
        <description>
            <text>
                Jan Ray е проектиран да пресъздаде ударния ясен тон на усилвателите Blackface Fender от 60-те - така нареченият звук "Fender Magic 6". Лесен за управление овърдрайв, запазващ характеристиките на китарата със страхотен състейн без неестествена компресия.
            </text>
        </description>
    </effect_pedal>
</effect_pedal_catalogue>